{
  "ident": "DY1502",
  "date": "2015-03-27",
  "date_arrival": "2015-03-28",
  "airline": {
    "iata": "DY",
    "icao": "NAX",
    "name": "Norwegian"
  },
  "orig": {
    "icao": "ENGM",
    "name": "Oslo"
  },
  "dest": {
    "iata": "PRG",
    "name": "Prague"
  },
  "times": {
    "std": "19:00",
    "atd": "19:08"
  },
  "aircraft": {
    "model": "73H"
  },
  "status": {
    "code": "departed",
    "delay": 8
  },
  "params": {
    "flying": true,
    "soldout": false
  },
  "rt": {
    "coords": [
      50.532,
      19.231
    ],
    "speed": 560
  },
  "time": "2015-03-27T01:38:05.419"
}